{
  "schema_version": "agentd.command_receipt.v1",
  "receipt_id": "cmd_1:response_started:1770000000100",
  "command_id": "cmd_1",
  "command_type": "user_message",
  "session_id": "sess_1",
  "trace_id": "0123456789abcdef0123456789abcdef",
  "stage": "response_started",
  "terminal": false,
  "retryable": false,
  "observed_at_unix_ms": 1770000000100
}
